<?xml version="1.0" standalone="yes"?>

<xs:schema xmlns:xs="http://www.w3.org/2001/XMLSchema">
    
    <xs:complexType name="authorList">
        <xs:sequence>
            <xs:element name="author" type="myAuthors" minOccurs="0" maxOccurs="unbounded" />
        </xs:sequence>
    </xs:complexType>
    
    <xs:complexType name="myAuthors">
        <xs:sequence>
            <xs:element name="name" type="xs:string" />
            <xs:element name="birthyear" type="xs:string" />
            <xs:element name="deathyear" type="xs:string"  minOccurs="0" maxOccurs="1"/>
            <xs:element name="birthplace" type="xs:string" />
            <xs:element name="country" type="xs:string" />
            <xs:element name="language" type="xs:string" />
            <xs:element name="bio" type="xs:string" />
        </xs:sequence>
    </xs:complexType>

    <xs:element name="authors" type="authorList" />
</xs:schema>