<?xml version="1.0" encoding="UTF-8" standalone="yes"?>
<authors xmlns:xsi="http://www.w3.org/2001/XMLSchema-instance"
 xsi:noNamespaceSchemaLocation="authors.xsd">
  <author>
    <name>Ian Lloyd</name>
    <birthyear>1995</birthyear>
    <deathyear>2020</deathyear>
    <birthplace>London</birthplace>
    <country>England</country>
    <language>en</language>
    <bio>Han var en god forfatter</bio>
  </author>
  <author>
    <name>John Smith</name>
    <birthyear>1990</birthyear>
    <deathyear/>
    <birthplace>New York</birthplace>
    <country>USA</country>
    <language>en</language>
    <bio>Han er en god forfatter</bio>
  </author>
  <author>
    <name>Pia</name>
    <birthyear>1850</birthyear>
    <deathyear>1940</deathyear>
    <birthplace>Esbjerg</birthplace>
    <country>Denmark</country>
    <language>DK</language>
    <bio>123</bio>
  </author>
</authors>