<?xml version="1.0" encoding="UTF-8" standalone="yes"?>

<authors xmlns:xsi="http://www.w3.org/2001/XMLSchema-instance" xsi:noNamespaceSchemaLocation="authors.xsd" 
xsl:noNamespaceSchemaLocation="author.xsl">

  <author>
    <name>Ian Lloyd</name>
    <birthyear>1995</birthyear>
    <deathyear>2020</deathyear>
    <birthplace>London</birthplace>
    <country>England</country>
    <language>en</language>
    <bio>Han var en god forfatter</bio>
  </author>
  <author>
    <name>John Smith</name>
    <birthyear>1990</birthyear>
    <deathyear/>
    <birthplace>New York</birthplace>
    <country>USA</country>
    <language>en</language>
    <bio>Han er en god forfatter</bio>
  </author>
  <author>
    <name>Nadia Skau</name>
    <birthyear>1990</birthyear>
    <deathyear/>
    <birthplace>Sønderborg</birthplace>
    <country>Danmark</country>
    <language>Dansk</language>
    <bio>Mega awesome</bio>
  </author>
  <author>
    <name>Morten Due</name>
    <birthyear>1998</birthyear>
    <deathyear/>
    <birthplace>Vamdrup</birthplace>
    <country>Danmark</country>
    <language>Dansk</language>
    <bio>Næsten awesome</bio>
  </author>
  <author>
    <name>Morten Højrup</name>
    <birthyear>1996</birthyear>
    <deathyear/>
    <birthplace>Esbjerg</birthplace>
    <country>Danmark</country>
    <language>Dansk</language>
    <bio>Totalt nørdet</bio>
  </author>
  <author>
    <name>Niels' kat</name>
    <birthyear>2000</birthyear>
    <deathyear/>
    <birthplace>Århus</birthplace>
    <country>Danmark</country>
    <language>Kinesisk</language>
    <bio>Kat</bio>
  </author>
  <author>
    <name>Niels' kat</name>
    <birthyear>2005</birthyear>
    <deathyear/>
    <birthplace>Århus</birthplace>
    <country>Danmark</country>
    <language>Fransk</language>
    <bio>Kat</bio>
  </author>
  <author>
    <name>Konrad</name>
    <birthyear>2015</birthyear>
    <deathyear/>
    <birthplace>Holstrebro</birthplace>
    <country>Danmark</country>
    <language>Dansk</language>
    <bio>Vuf</bio>
  </author>
  <author>
    <name>Chris</name>
    <birthyear>1985</birthyear>
    <deathyear/>
    <birthplace>Kolding</birthplace>
    <country>Danmark</country>
    <language>Dansk</language>
    <bio>Hvem er det</bio>
  </author>
  <author>
    <name>Erik</name>
    <birthyear>1980</birthyear>
    <deathyear/>
    <birthplace>Kolding</birthplace>
    <country>Danmark</country>
    <language>Tysk</language>
    <bio>Glem det</bio>
  </author>
  <author>
    <name>Bella</name>
    <birthyear>1889</birthyear>
    <deathyear>1989</deathyear>
    <birthplace>Skagen</birthplace>
    <country>Danmark</country>
    <language>Norsk</language>
    <bio>Bella var sød</bio>
  </author>
  <author>
    <name>Arthur</name>
    <birthyear>1776</birthyear>
    <deathyear>1826</deathyear>
    <birthplace>Odense</birthplace>
    <country>Danmark</country>
    <language>Dansk</language>
    <bio>Hey du</bio>
  </author>
</authors>