<?xml version="1.0" standalone="no"?> <?xml-stylesheet type="text/xsl" href="sortAuthor.xsl"?><authors xmlns:xsi="http://www.w3.org/2001/XMLSchema-instance" xsi:noNamespaceSchemaLocation="authors.xsd">
  <author>
    <name>Ian Lloyd</name>
    <birthyear>1995</birthyear>
    <deathyear>2020</deathyear>
    <birthplace>London</birthplace>
    <country>England</country>
    <language>en</language>
    <bio>Han var en god forfatter</bio>
  </author>
  <author>
    <name>John Smith</name>
    <birthyear>1990</birthyear>
    <deathyear/>
    <birthplace>New York</birthplace>
    <country>USA</country>
    <language>en</language>
    <bio>Han er en god forfatter</bio>
  </author>
  <author>
    <name>Nadia Skau</name>
    <birthyear>1990</birthyear>
    <deathyear/>
    <birthplace>Sønderborg</birthplace>
    <country>Danmark</country>
    <language>Dansk</language>
    <bio>Mega awesome</bio>
  </author>
  <author>
    <name>Nadia Skau</name>
    <birthyear>1990</birthyear>
    <deathyear/>
    <birthplace/>
    <country>Danmark</country>
    <language>Dansk</language>
    <bio>Mega awesome</bio>
  </author>
  <author>
    <name>Morten Due</name>
    <birthyear>1998</birthyear>
    <deathyear/>
    <birthplace>Vamdrup</birthplace>
    <country>Danmark</country>
    <language>Dansk</language>
    <bio>Næsten awesome</bio>
  </author>
  <author>
    <name>Morten Due</name>
    <birthyear>1998</birthyear>
    <deathyear/>
    <birthplace>Vamdrup</birthplace>
    <country>Danmark</country>
    <language>Dansk</language>
    <bio>Næsten awesome</bio>
  </author>
  <author>
    <name>Morten Højrup</name>
    <birthyear>1996</birthyear>
    <deathyear/>
    <birthplace>Esbjerg</birthplace>
    <country>Danmark</country>
    <language>Dansk</language>
    <bio>Totalt nørdet</bio>
  </author>
  <author>
    <name>Louise</name>
    <birthyear>1986</birthyear>
    <deathyear/>
    <birthplace>Kolding</birthplace>
    <country>Danmark</country>
    <language>Dansk</language>
    <bio>Lærer</bio>
  </author>
  <author>
    <name>Louise</name>
    <birthyear>1986</birthyear>
    <deathyear/>
    <birthplace>Kolding</birthplace>
    <country>Danmark</country>
    <language>Dansk</language>
    <bio>Lærer</bio>
  </author>
  <author>
    <name>Louise</name>
    <birthyear>1986</birthyear>
    <deathyear/>
    <birthplace>Kolding</birthplace>
    <country>Danmark</country>
    <language>Dansk</language>
    <bio>Lærer</bio>
  </author>
  <author>
    <name>Nadia Skau</name>
    <birthyear>1990</birthyear>
    <deathyear/>
    <birthplace>Sønderborg</birthplace>
    <country>Danmark</country>
    <language>Dansk</language>
    <bio>Lærer</bio>
  </author>
  <author>
    <name>Nadia Skau</name>
    <birthyear>1986</birthyear>
    <deathyear/>
    <birthplace>Kolding</birthplace>
    <country>Danmark</country>
    <language>Dansk</language>
    <bio>Lærer</bio>
  </author>
  <author>
    <name>Morten Due</name>
    <birthyear>1998</birthyear>
    <deathyear/>
    <birthplace>Flensborg</birthplace>
    <country>Tyskland</country>
    <language>Tysk</language>
    <bio>Tysker</bio>
  </author>
</authors>